{
  "schema_version": "1",
  "decision_id": "ADR-0029",
  "project_id": "PRJ-SYSTEM-ENGINEERING",
  "category": "architecture",
  "date": "2026-10-22",
  "context": "SE-AUTOMATION-001 roadmap (B0) defines AUTO-05 as 'consistency' — a read-only aggregation check verifying integrity across tasks, executions, artifacts, evidence, gates, versions, adapter, and cross-references. The initiative requires a deterministic, machine-readable consistency operation that composes existing validation functions without adding new authority, engines, or persistent state.",
  "problem": "How can SYSTEM-ENGINEERING expose a deterministic consistency check (CON-01 through CON-10) as a read-only operation, reusing existing doctor/validate/observe/evaluate_gate functions, with a stable machine-readable envelope, without adding a new command to the public surface or regenerating the OpenCode adapter?",
  "options_considered": [
    {
      "option": "New command `se consistency` (CMD-0025)",
      "pros": ["Explicit discoverable command", "Can extend checklist independently", "Clear contract boundary"],
      "cons": ["Expands public command surface", "Requires COMMANDS/commands.json change + ADR + tests + adapter regeneration (25 commands)", "Duplicates health aggregation pattern"]
    },
    {
      "option": "Extend `se health --scope consistency` (chosen)",
      "pros": ["Reuses existing health aggregation infrastructure", "No new command contract", "No adapter regeneration (24 commands unchanged)", "Consistent with ADR-0022 minimum-context/on-demand scope model", "Single envelope `se.auto/1` with health_operation=\"consistency\""],
      "cons": ["Health command grows in responsibility", "Must ensure scope parameter doesn't conflict with future health scopes"]
    },
    {
      "option": "Defer AUTO-05",
      "pros": ["Zero implementation risk", "No scope creep"],
      "cons": ["Roadmap commitment unmet", "No deterministic consistency envelope for SE-CONSOLE/CI consumption"]
    }
  ],
  "decision": "Implement AUTO-05 consistency as a new `--scope consistency` option on the existing `se health` command (Alternativa 2). The operation composes ten read-only checks (CON-01..CON-10) by calling existing functions: `_load_execution_receipts`, `collection()`, `check_manifest_outputs`, `check_adapter`, `check_manifests`, `check_project_alignment`, `evaluate_gate`, and artifact checksum verification. Output uses the existing `se.auto/1` envelope with `health_operation=\"consistency\"` and `scope=\"deep\"`. Exit codes: 0=PASS, 1=FAIL, 2=usage error, 3=operational error. No new command, no adapter regeneration, no schema changes.",
  "reason": "The consistency check is a natural extension of health aggregation (ADR-0022). Adding a scope parameter preserves the single-command health surface, avoids adapter churn, and keeps the contract minimal. The ten checks map directly to existing validation functions; no new authority or persistence is introduced. This aligns with STATE_POLICY.md (no new engines/stores) and EXECUTION_INTEGRITY.md (read-only aggregation).",
  "consequences": "Positive: deterministic consistency envelope available immediately; reuses 100% existing validation logic; zero adapter impact; backward compatible. Negative: health command gains a sixth scope; future health scopes must coordinate naming. The `se.auto/1` envelope is reused with `health_operation=\"consistency\"` — consumers must handle this new operation value. Exit codes follow CLI convention (0/1/2/3). No changes to COMMANDS/commands.json, no new schema, no adapter regeneration.",
  "affected_components": [
    "SCRIPTS/se_core/cli.py (--scope argument)",
    "SCRIPTS/se_core/commands.py (run_consistency_checks, cmd_health dispatch)",
    "TESTS/ (hermetic tests for consistency scope)"
  ],
  "status": "ACCEPTED",
  "supersedes": null,
  "superseded_by": null,
  "author": "principal-architect",
  "created_at": "2026-10-22T00:00:00Z",
  "updated_at": "2026-10-22T00:00:00Z",
  "related_tasks": [],
  "related_requirements": [],
  "metadata": {
    "scope": "SE-AUTOMATION-001G (AUTO-05)",
    "depends_on_adr": ["ADR-0015", "ADR-0022", "ADR-0024"],
    "references": [
      "DOCS/STATE_POLICY.md",
      "DOCS/EXECUTION_INTEGRITY.md",
      "SE-AUTOMATION-001 B0 roadmap (AUTO-05 consistency)",
      "SE-AUTOMATION-001G-AUTO-05-CONSISTENCY-SPEC.md"
    ]
  }
}