{
  "schema_version": "1",
  "decision_id": "ADR-0025",
  "project_id": "PRJ-SYSTEM-ENGINEERING",
  "category": "architecture",
  "date": "2026-10-14",
  "context": "FASE 1-4 of the token economy initiative implemented context filtering (engine), summarization (runner), token budget protection (runner), and telemetry (runner). These operate at runtime with defaults and agent-level config. FASE 5 requires per-node budget control in the workflow definition itself, allowing workflow authors to declare explicit token budgets per step based on the step's complexity and risk.",
  "problem": "How to add per-node token budget control to the workflow schema without breaking existing workflows, while maintaining backward compatibility and the deterministic execution model?",
  "options_considered": [
    { "option": "Add required max_context_tokens field to node schema", "pros": ["Explicit budget everywhere"], "cons": ["Breaks all existing workflows", "Forces authors to estimate tokens upfront"] },
    { "option": "Add optional max_context_tokens field with default from agent config", "pros": ["Backward compatible", "Opt-in per node", "Falls back to agent-level then global default"], "cons": ["Requires schema version bump", "Engine must resolve default chain"] },
    { "option": "Add max_context_tokens at workflow level only", "pros": ["Simpler schema"], "cons": ["Too coarse; different nodes need different budgets"] }
  ],
  "decision": "Add optional `max_context_tokens` field to workflow node schema (integer, minimum 256). When present, it overrides the agent's llm_config.max_tokens for that specific node's context budget calculation. When absent, the agent's llm_config.max_tokens (default 4096) is used. The 70% budget rule (FASE 2) applies to the resolved max_tokens. Schema version remains 1 (additive optional field).",
  "reason": "Optional field preserves backward compatibility. Default chain (node > agent > global) gives flexibility. The 70% rule in runner remains unchanged — only the input max_tokens changes. No new runtime mechanisms needed.",
  "consequences": "Existing workflows validate and run unchanged. New workflows can opt-in to per-node budgets. Engine passes resolved max_tokens to AgentRunner. Tests updated to cover both paths. No migration required.",
  "affected_components": ["SCHEMAS/workflow/workflow.schema.json", "SCRIPTS/se_core/orchestration/engine.py", "SCRIPTS/se_core/agents/runner.py", "TESTS/test_orchestrate.py"],
  "status": "ACCEPTED",
  "supersedes": null,
  "superseded_by": null,
  "author": "principal-architect",
  "created_at": "2026-10-14T00:00:00Z",
  "updated_at": "2026-10-14T00:00:00Z",
  "related_tasks": [],
  "related_requirements": [],
  "metadata": {
    "scope": "TOKEN-ECONOMY-FASE-5",
    "depends_on_adr": [],
    "references": ["SCHEMAS/workflow/workflow.schema.json", "FASE 1-4 implementation"]
  }
}