{
  "schema_version": "1",
  "decision_id": "ADR-0017",
  "project_id": "PRJ-SYSTEM-ENGINEERING",
  "category": "architecture",
  "date": "2026-09-19",
  "context": "OpenCode only discovers agents, commands and skills from standard locations (.opencode/agent|command|skill for a project, ~/.config/opencode/... for global). SYSTEM-ENGINEERING defines the contracts in AGENTS/*/agent.json, COMMANDS/commands.json and SKILLS/. Restriction: no dependence on OpenCode reading arbitrary folders, and every agent must come from a contract. ADR-0015 adopted an adapter-only bridge.",
  "problem": "How are OpenCode assets produced from the contracts so they live in discoverable locations, stay versioned, and never drift from the source of truth?",
  "options_considered": [
    { "option": "Generation pipeline via `se adapter opencode`", "pros": ["Single source of truth (contracts)", "Generated assets are committed and reviewable", "Drift detectable by comparing hashes", "Standard OpenCode locations"], "cons": ["Requires a generator + tests", "Regeneration needed on contract changes"] },
    { "option": "Hand-write OpenCode assets per contract", "pros": ["No generator"], "cons": ["Duplication and drift", "Agents not guaranteed to match contracts", "Violates contract source requirement"] },
    { "option": "Define agents inline in opencode.json", "pros": ["Valid OpenCode mechanism"], "cons": ["Blurs the contract source", "Noise and unmaintainable at scale"] }
  ],
  "decision": "Implement a generation pipeline owned by `se adapter opencode`. Every OpenCode agent (.opencode/agent/<role>.md) is generated from AGENTS/*/agent.json; every command (.opencode/command/<cmd>.md) from COMMANDS/commands.json (body wraps se.py); every skill from SKILLS/. Generated assets are committed. opencode.json and AGENTS.md are generated from contracts, policies and docs. `se validate` recomputes a hash of each contract against its generated asset and reports drift.",
  "reason": "It guarantees every agent comes from a contract (restriction 5), uses only standard OpenCode discovery locations (restriction 4), keeps one source of truth, and makes drift detectable in CI.",
  "consequences": "SCRIPTS/se_core gains an adapter module. TESTS must cover round-trip (contract -> generated -> schema valid). Contract changes require regeneration; drift is a validation failure.",
  "affected_components": ["SCRIPTS", "AGENTS", "COMMANDS", "SKILLS", "TESTS", "INTEGRATIONS/opencode"],
  "status": "ACCEPTED",
  "supersedes": null,
  "superseded_by": null,
  "author": "principal-architect",
  "created_at": "2026-09-19T00:00:00Z",
  "updated_at": "2026-09-19T00:00:00Z",
  "related_tasks": [],
  "related_requirements": [],
  "metadata": {
    "scope": "MASTER-SYSTEM-CHECKPOINT-001",
    "depends_on_adr": ["ADR-0015"]
  }
}